{
  "schema": "pineforge/facts/v1",
  "scoreboard": {
    "source": "Registry baseline pineforge-parity-baseline-20261029-release-tag-cfe0a186; digest-verified snapshot cfe0a186457181085651dbcd272687875870ed4d6a6b3f23286c414c74bb111f; private evidence sha256:1d1e99946542c67fe6299ba8446293309a86d1fa9acfc34dec7985f2f7cdb458.",
    "provenance": {
      "baselineId": "pineforge-parity-baseline-20261029-release-tag-cfe0a186",
      "snapshotSha256": "cfe0a186457181085651dbcd272687875870ed4d6a6b3f23286c414c74bb111f",
      "populationSha256": "cf857209574e03b760a308393d67c0eec114fb996749221f32de84c387f1b062",
      "engineCommit": "ec4496878518da7c2b5ef9152c1e9c6b46dc4314",
      "codegenCommit": "7c1b3dec9916195638995e4bd3c627b39ff82e26",
      "promotionDate": "2026-10-29T21:05:15.154Z",
      "privateEvidenceSha256": "1d1e99946542c67fe6299ba8446293309a86d1fa9acfc34dec7985f2f7cdb458"
    },
    "id": "pineforge-parity-baseline-20261029-release-tag-cfe0a186",
    "date": "2026-10-29",
    "engineCommit": "ec4496878518da7c2b5ef9152c1e9c6b46dc4314",
    "codegenCommit": "7c1b3dec9916195638995e4bd3c627b39ff82e26",
    "snapshotSha256": "cfe0a186457181085651dbcd272687875870ed4d6a6b3f23286c414c74bb111f",
    "populationSha256": "cf857209574e03b760a308393d67c0eec114fb996749221f32de84c387f1b062",
    "population": 8006,
    "anomaliesExcluded": 17,
    "graded": 7989,
    "excellent": 7983,
    "strong": 6,
    "belowStrong": 0,
    "engineErrors": 0,
    "tiers": {
      "excellent": 7983,
      "strong": 6,
      "moderate": 0,
      "weak": 0,
      "minimal": 0,
      "no-trades": 0
    },
    "scopes": {
      "corpus": {
        "graded": 309,
        "excellent": 309,
        "strong": 0,
        "belowStrong": 0,
        "engineErrors": 0,
        "tiers": {
          "excellent": 309,
          "strong": 0,
          "moderate": 0,
          "weak": 0,
          "minimal": 0,
          "no-trades": 0
        }
      },
      "closed": {
        "graded": 7680,
        "excellent": 7674,
        "strong": 6,
        "belowStrong": 0,
        "engineErrors": 0,
        "tiers": {
          "excellent": 7674,
          "strong": 6,
          "moderate": 0,
          "weak": 0,
          "minimal": 0,
          "no-trades": 0
        }
      }
    },
    "excellentPct": 99.92,
    "strongPct": 0.08,
    "excellentOrStrongPct": 100,
    "markets": 9,
    "timeframes": 2,
    "lanes": 18,
    "corpusProbes": 309,
    "closedProbes": 7680,
    "hardLane": {
      "symbol": "BINANCE:ETHUSDT.P",
      "timeframe": "15",
      "hardProbes": 1009,
      "corpusProbes": 309,
      "closedProbes": 700,
      "graded": 1009,
      "excellent": 1009,
      "strong": 0,
      "belowStrong": 0,
      "engineErrors": 0,
      "tiers": {
        "excellent": 1009,
        "strong": 0,
        "moderate": 0,
        "weak": 0,
        "minimal": 0,
        "no-trades": 0
      }
    },
    "pairs": [
      {
        "symbol": "BINANCE:ETHUSDT.P",
        "timeframe": "15",
        "hardProbes": 1009,
        "corpusProbes": 309,
        "closedProbes": 700,
        "graded": 1009,
        "excellent": 1009,
        "strong": 0,
        "belowStrong": 0,
        "engineErrors": 0,
        "tiers": {
          "excellent": 1009,
          "strong": 0,
          "moderate": 0,
          "weak": 0,
          "minimal": 0,
          "no-trades": 0
        }
      },
      {
        "symbol": "BINANCE:BTCUSDT",
        "timeframe": "15",
        "hardProbes": 0,
        "corpusProbes": 0,
        "closedProbes": 668,
        "graded": 668,
        "excellent": 666,
        "strong": 2,
        "belowStrong": 0,
        "engineErrors": 0,
        "tiers": {
          "excellent": 666,
          "strong": 2,
          "moderate": 0,
          "weak": 0,
          "minimal": 0,
          "no-trades": 0
        }
      },
      {
        "symbol": "BINANCE:BTCUSDT",
        "timeframe": "1D",
        "hardProbes": 0,
        "corpusProbes": 0,
        "closedProbes": 516,
        "graded": 516,
        "excellent": 516,
        "strong": 0,
        "belowStrong": 0,
        "engineErrors": 0,
        "tiers": {
          "excellent": 516,
          "strong": 0,
          "moderate": 0,
          "weak": 0,
          "minimal": 0,
          "no-trades": 0
        }
      },
      {
        "symbol": "BINANCE:ETHUSDT.P",
        "timeframe": "1D",
        "hardProbes": 0,
        "corpusProbes": 0,
        "closedProbes": 540,
        "graded": 540,
        "excellent": 540,
        "strong": 0,
        "belowStrong": 0,
        "engineErrors": 0,
        "tiers": {
          "excellent": 540,
          "strong": 0,
          "moderate": 0,
          "weak": 0,
          "minimal": 0,
          "no-trades": 0
        }
      },
      {
        "symbol": "CME_MINI:ES1!",
        "timeframe": "15",
        "hardProbes": 0,
        "corpusProbes": 0,
        "closedProbes": 76,
        "graded": 76,
        "excellent": 76,
        "strong": 0,
        "belowStrong": 0,
        "engineErrors": 0,
        "tiers": {
          "excellent": 76,
          "strong": 0,
          "moderate": 0,
          "weak": 0,
          "minimal": 0,
          "no-trades": 0
        }
      },
      {
        "symbol": "CME_MINI:ES1!",
        "timeframe": "1D",
        "hardProbes": 0,
        "corpusProbes": 0,
        "closedProbes": 35,
        "graded": 35,
        "excellent": 35,
        "strong": 0,
        "belowStrong": 0,
        "engineErrors": 0,
        "tiers": {
          "excellent": 35,
          "strong": 0,
          "moderate": 0,
          "weak": 0,
          "minimal": 0,
          "no-trades": 0
        }
      },
      {
        "symbol": "CME_MINI:NQ1!",
        "timeframe": "15",
        "hardProbes": 0,
        "corpusProbes": 0,
        "closedProbes": 74,
        "graded": 74,
        "excellent": 74,
        "strong": 0,
        "belowStrong": 0,
        "engineErrors": 0,
        "tiers": {
          "excellent": 74,
          "strong": 0,
          "moderate": 0,
          "weak": 0,
          "minimal": 0,
          "no-trades": 0
        }
      },
      {
        "symbol": "CME_MINI:NQ1!",
        "timeframe": "1D",
        "hardProbes": 0,
        "corpusProbes": 0,
        "closedProbes": 37,
        "graded": 37,
        "excellent": 37,
        "strong": 0,
        "belowStrong": 0,
        "engineErrors": 0,
        "tiers": {
          "excellent": 37,
          "strong": 0,
          "moderate": 0,
          "weak": 0,
          "minimal": 0,
          "no-trades": 0
        }
      },
      {
        "symbol": "NASDAQ:AAPL",
        "timeframe": "15",
        "hardProbes": 0,
        "corpusProbes": 0,
        "closedProbes": 632,
        "graded": 632,
        "excellent": 631,
        "strong": 1,
        "belowStrong": 0,
        "engineErrors": 0,
        "tiers": {
          "excellent": 631,
          "strong": 1,
          "moderate": 0,
          "weak": 0,
          "minimal": 0,
          "no-trades": 0
        }
      },
      {
        "symbol": "NASDAQ:AAPL",
        "timeframe": "1D",
        "hardProbes": 0,
        "corpusProbes": 0,
        "closedProbes": 464,
        "graded": 464,
        "excellent": 464,
        "strong": 0,
        "belowStrong": 0,
        "engineErrors": 0,
        "tiers": {
          "excellent": 464,
          "strong": 0,
          "moderate": 0,
          "weak": 0,
          "minimal": 0,
          "no-trades": 0
        }
      },
      {
        "symbol": "NSE:NIFTY",
        "timeframe": "15",
        "hardProbes": 0,
        "corpusProbes": 0,
        "closedProbes": 314,
        "graded": 314,
        "excellent": 314,
        "strong": 0,
        "belowStrong": 0,
        "engineErrors": 0,
        "tiers": {
          "excellent": 314,
          "strong": 0,
          "moderate": 0,
          "weak": 0,
          "minimal": 0,
          "no-trades": 0
        }
      },
      {
        "symbol": "NSE:NIFTY",
        "timeframe": "1D",
        "hardProbes": 0,
        "corpusProbes": 0,
        "closedProbes": 225,
        "graded": 225,
        "excellent": 225,
        "strong": 0,
        "belowStrong": 0,
        "engineErrors": 0,
        "tiers": {
          "excellent": 225,
          "strong": 0,
          "moderate": 0,
          "weak": 0,
          "minimal": 0,
          "no-trades": 0
        }
      },
      {
        "symbol": "NYSE:F",
        "timeframe": "15",
        "hardProbes": 0,
        "corpusProbes": 0,
        "closedProbes": 637,
        "graded": 637,
        "excellent": 636,
        "strong": 1,
        "belowStrong": 0,
        "engineErrors": 0,
        "tiers": {
          "excellent": 636,
          "strong": 1,
          "moderate": 0,
          "weak": 0,
          "minimal": 0,
          "no-trades": 0
        }
      },
      {
        "symbol": "NYSE:F",
        "timeframe": "1D",
        "hardProbes": 0,
        "corpusProbes": 0,
        "closedProbes": 505,
        "graded": 505,
        "excellent": 505,
        "strong": 0,
        "belowStrong": 0,
        "engineErrors": 0,
        "tiers": {
          "excellent": 505,
          "strong": 0,
          "moderate": 0,
          "weak": 0,
          "minimal": 0,
          "no-trades": 0
        }
      },
      {
        "symbol": "OANDA:EURUSD",
        "timeframe": "15",
        "hardProbes": 0,
        "corpusProbes": 0,
        "closedProbes": 653,
        "graded": 653,
        "excellent": 652,
        "strong": 1,
        "belowStrong": 0,
        "engineErrors": 0,
        "tiers": {
          "excellent": 652,
          "strong": 1,
          "moderate": 0,
          "weak": 0,
          "minimal": 0,
          "no-trades": 0
        }
      },
      {
        "symbol": "OANDA:EURUSD",
        "timeframe": "1D",
        "hardProbes": 0,
        "corpusProbes": 0,
        "closedProbes": 453,
        "graded": 453,
        "excellent": 453,
        "strong": 0,